{
  "version": "1.0",
  "payload_schema_id": "urn:project-gateway:schema:artifact:1.0:common:extension-declaration",
  "semantic_contract_ids": [
    "REG-006"
  ],
  "supported_kinds": [
    {
      "kind_id": "AuthorityPolicy",
      "kind_version": "1.0"
    },
    {
      "kind_id": "CompletionContract",
      "kind_version": "1.0"
    },
    {
      "kind_id": "ContextManifest",
      "kind_version": "1.0"
    },
    {
      "kind_id": "ExecutionBundle",
      "kind_version": "1.0"
    },
    {
      "kind_id": "ExecutionResult",
      "kind_version": "1.0"
    },
    {
      "kind_id": "TaskSpec",
      "kind_version": "1.0"
    }
  ],
  "supported_modes": [
    "optional"
  ],
  "ignore_safety": "ignore-safe",
  "deprecation": {
    "status": "active"
  },
  "supersession": null
}
